<?xml version="1.0" encoding="UTF-8" standalone="no"?>
<!DOCTYPE biblioteca SYSTEM "06_DTD_Biblioteca.dtd">
<biblioteca>
    <documentos>
        <libros>
            <libro id="L0001" tipo_clase="novela" num_paginas="310">
                <titulo></titulo>
                <sinopsis></sinopsis>
                <indice>
                    <capitulo num_paginas="100">
                        <titulo></titulo>
                        <contenido link="https://www.w3schools.com/xml/xml_schema.asp">
                        </contenido>
                    </capitulo>
                    <capitulo num_paginas="100">
                        <titulo></titulo>
                        <contenido link="www.talycual.com">
                        </contenido>
                    </capitulo>
                    <capitulo num_paginas="100">
                        <titulo></titulo>
                        <contenido link="www.talycual.com">
                        </contenido>
                    </capitulo>
                </indice>
            </libro>
            <libro id="L0002" tipo_clase="infantil" num_paginas="310">
                <titulo></titulo>
                <sinopsis></sinopsis>
                <indice>
                    <capitulo num_paginas="100">
                        <titulo></titulo>
                        <contenido link="www.talycual.com">
                        </contenido>
                    </capitulo>
                    <capitulo num_paginas="100">
                        <titulo></titulo>
                        <contenido link="www.talycual.com">
                        </contenido>
                    </capitulo>
                    <capitulo num_paginas="100">
                        <titulo></titulo>
                        <contenido link="www.talycual.com">
                        </contenido>
                    </capitulo>
                </indice>
            </libro>
            <libro id="L0003" tipo_clase="didactico" num_paginas="310">
                <titulo></titulo>
                <sinopsis></sinopsis>
                <indice>
                    <capitulo num_paginas="100">
                        <titulo></titulo>
                        <contenido link="www.talycual.com">
                        </contenido>
                    </capitulo>
                    <capitulo num_paginas="100">
                        <titulo></titulo>
                        <contenido link="www.talycual.com">
                        </contenido>
                    </capitulo>
                    <capitulo num_paginas="100">
                        <titulo></titulo>
                        <contenido link="www.talycual.com">
                        </contenido>
                    </capitulo>
                </indice>
            </libro>
        </libros>
        <revistas>
            <revista id="R0001" tipo_clase="informatica" num_paginas="300">
                <titulo></titulo>
                <num_revista></num_revista>
                <indice>
                    <seccion num_paginas="100">                            
                        <contenido link="www.talycual.com">
                        </contenido>
                    </seccion>
                    <seccion num_paginas="100">                            
                        <contenido link="www.talycual.com">
                        </contenido>
                    </seccion>
                </indice>
            </revista>
            <revista id="R0002" tipo_clase="corazon" num_paginas="300">
                <titulo></titulo>
                <num_revista></num_revista>
                <indice>
                    <seccion num_paginas="100">                            
                        <contenido link="www.talycual.com">
                        </contenido>
                    </seccion>
                    <seccion num_paginas="100">                            
                        <contenido link="www.talycual.com">
                        </contenido>
                    </seccion>
                </indice>
            </revista>
            <revista id="R0003" tipo_clase="coches" num_paginas="300">
                <titulo></titulo>
                <num_revista></num_revista>
                <indice>
                    <seccion num_paginas="100">                            
                        <contenido link="www.talycual.com">
                        </contenido>
                    </seccion>
                    <seccion num_paginas="100">                            
                        <contenido link="www.talycual.com">
                        </contenido>
                    </seccion>
                </indice>
            </revista>
            <revista id="R0004" tipo_clase="investigacion" num_paginas="300">
                <titulo></titulo>
                <num_revista></num_revista>
                <indice>
                    <seccion num_paginas="100">                            
                        <contenido link="www.talycual.com">
                        </contenido>
                    </seccion>
                    <seccion num_paginas="100">                            
                        <contenido link="www.talycual.com">
                        </contenido>
                    </seccion>
                </indice>
            </revista>
            <revista id="R0005" tipo_clase="otras" num_paginas="300">
                <titulo></titulo>
                <num_revista></num_revista>
                <indice>
                        <seccion num_paginas="100">                            
                            <contenido link="www.talycual.com">
                            </contenido>
                        </seccion>
                        <seccion num_paginas="100">                            
                            <contenido link="www.talycual.com">
                            </contenido>
                        </seccion>
                </indice>
            </revista>
        </revistas>
        <periodicos>
            <periodico id="P0001" tipo_clase="nacional" fecha_publi="16/02/1990">
                <indice>
                    <seccion_periodico tipo_seccion="economica">  
                        <articulo autor="Strauss">
                            <contenido link="www.talycual.com">
                            </contenido>
                        </articulo> 
                        <articulo autor="Chopin">
                            <contenido link="www.talycual.com">
                            </contenido>
                        </articulo> 
                    </seccion_periodico>
                    <seccion_periodico tipo_seccion="opinion">  
                        <articulo autor="Mozart">
                            <contenido link="www.talycual.com">
                            </contenido>
                        </articulo> 
                        <articulo autor="Wagner">
                            <contenido link="www.talycual.com">
                            </contenido>
                        </articulo>                           
                    </seccion_periodico>
                    <seccion_periodico tipo_seccion="deportes">  
                        <articulo autor="Stravinsky">
                            <contenido link="www.talycual.com">
                            </contenido>
                        </articulo> 
                        <articulo autor="Rachmaninoff">
                            <contenido link="www.talycual.com">
                            </contenido>
                        </articulo>                           
                    </seccion_periodico>
                    <seccion_periodico tipo_seccion="nacional">  
                        <articulo autor="Bach">
                            <contenido link="www.talycual.com">
                            </contenido>
                        </articulo> 
                        <articulo autor="Mahler">
                            <contenido link="www.talycual.com">
                            </contenido>
                        </articulo>                           
                    </seccion_periodico>
                    <seccion_periodico tipo_seccion="internacional">  
                        <articulo autor="Granados">
                            <contenido link="www.talycual.com">
                            </contenido>
                        </articulo> 
                        <articulo autor="Albeniz">
                            <contenido link="www.talycual.com">
                            </contenido>
                        </articulo>                           
                    </seccion_periodico>
                </indice>
            </periodico>
            <periodico id="P0002" tipo_clase="internacional" fecha_publi="16/02/1985">
                <indice>
                    <seccion_periodico tipo_seccion="economica">  
                        <articulo autor="McCartney">
                            <contenido link="www.talycual.com">
                            </contenido>
                        </articulo> 
                        <articulo autor="Lennon">
                            <contenido link="www.talycual.com">
                            </contenido>
                        </articulo> 
                    </seccion_periodico>
                    <seccion_periodico tipo_seccion="opinion">  
                        <articulo autor="Cobain">
                            <contenido link="www.talycual.com">
                            </contenido>
                        </articulo> 
                        <articulo autor="Curtis">
                            <contenido link="www.talycual.com">
                            </contenido>
                        </articulo>                           
                    </seccion_periodico>